question_id,category,difficulty,model,response,timestamp
Q014,CONCEPT,medium,groq-llama,"The offside trap is a tactical maneuver executed by a defensive line to neutralize an opponent's attacking threat. It involves the defenders creating a situation where the opponent, who is approaching them in an offside position, is caught out by an 'intercept' or a 'switch' in play, typically resulting in a more defendable ball possession and a counterattack opportunity for the team that set the offside trap.

Here's a step-by-step explanation of how an offside trap is typically executed:

1. **Identifying the opponent's positioning**: The defensive coaches and players closely monitor the opponent's striker or attacking midfielder, looking for signs that they are getting into an offside position.

2. **Signaling the trap**: The defensive coach signals to their players to execute the offside trap or they will set it up themselves with subtle hand signals to their fellow defender.

3. **Setting the trap**: The defensive fullbacks and central defenders create a 'wall' or zone in front of the goal, with the intention of intercepting the ball and preventing it from reaching the opponent in the offside position.

4. **The 'switch':** As the ball is played forward, the opposing team's forward, who was initially in an offside position, needs to quickly make a decisive run and become level with the last defender before the ball reaches them.

5. **The intercept**: The defensive wall intercepts the ball, often in a more defendable position, usually near the center of the field or in their own half, and gains possession of the ball.

6. **The counterattack**: The team that set the offside trap then attempts to quickly transition to a counterattack, using the regained possession to create a new attacking opportunity.

It's worth noting that an offside trap can be risky if executed poorly, as the opponent can quickly exploit it by using speed or clever movements to stay onside, which can result in a scoring opportunity against the defensive team.",2026-05-20T07:59:02.206300+00:00
Q014,CONCEPT,medium,groq-llama70b,"The offside trap is a defensive tactic used by a team to catch an opponent's player in an offside position. It involves the defensive line stepping up or moving forward in unison, with the goal of placing the opponent's player behind them, thus making them offside.

To execute the offside trap, the defensive line must work together and communicate effectively. Here's a step-by-step explanation:

1. **Identifying the opponent's attack**: The defensive line anticipates an opponent's attack, often when they're pushing forward and trying to play a through ball or long pass behind the defense.
2. **Stepping up**: The defensive line, usually led by the center-backs, takes a few steps forward as a unit. This creates a new defensive line, higher up the pitch than their original position.
3. **Aligning with the second-to-last defender**: The defensive line must ensure they're even with the second-to-last defender (usually the last defender before the goalkeeper). This is crucial, as if one defender steps up too far, it can create space for the opponent to exploit.
4. **Timing the step-up**: The defensive line must time their step-up perfectly, taking into account the opponent's movement and the trajectory of the ball. If they step up too early, the opponent may be able to adjust and stay onside. If they step up too late, the opponent may already be past them.
5. **Flagging the offside**: If the opponent's player is behind the defensive line when the ball is played forward, the referee will raise their flag, indicating an offside infraction.

The offside trap requires excellent communication, coordination, and timing among the defensive line. If executed correctly, it can be an effective way to neutralize an opponent's attacking threat and gain possession of the ball. However, if not done correctly, it can leave the defense vulnerable to counter-attacks and create scoring opportunities for the opponent.",2026-05-20T07:59:04.729018+00:00
Q015,CONCEPT,medium,groq-llama,"A three-at-the-back formation, also known as a 3-4-3 or 3-5-2, is a defensive setup where three players line up at the back, typically as center-backs. Their main role is to support each other in defending the goal.

In a 3-4-3 formation, there are three main types of center-backs:

1. The central leader or sweeper: This player, often the most experienced, is responsible for coordinating the three defenders and sweeping up any opposition attacks that pass through the midfield area.
2. The left and right fullbacks: These players provide support to the wing players (wingers) and help the team transition between defense and offense by making runs up the flank.

The three center-backs can be positioned in various ways, but common configurations include the following:

- A traditional 'triangle' shape, with the players forming a solid base and covering the opponent's attacks.
- A 'w' or 'u' shape, where the center-backs form an inverted 'w' or 'u' to provide additional defensive solidity on the flanks.

The three-at-the-back system offers several advantages:

- Better defensive stability, as one less opponent can be targeted for attacks.
- Increased defensive flexibility, allowing players to switch roles and respond to different opponents.
- A more balanced team shape, as the midfield four can be arranged in various ways to counter opposition tactics.

However, this system also has its limitations, such as:

- Reduced attacking width, as the fullbacks might be deployed more centrally to support the defense.
- Increased pressure on the midfield four, who have to provide width and support to both defense and offense.

Overall, the 3-4-3 formation is a popular choice among top-flight teams, particularly those with a strong defensive base and a balanced midfield.",2026-05-20T07:59:06.774825+00:00
Q015,CONCEPT,medium,groq-llama70b,"A three-at-the-back formation is a defensive tactical setup in football where three defenders are used as the primary defensive unit, rather than the traditional four. This formation can be denoted as 3-4-3, 3-5-2, or 3-1-4-2, among others, depending on the number of midfielders and forwards used.

In a typical three-at-the-back formation, the three defenders are arranged in a flat line or with one defender slightly deeper than the other two, often referred to as a ""sweeper"" or ""libero."" The three defenders are usually:

1. A left-sided center-back: Responsible for defending the left flank and supporting the left-wing back or midfielder.
2. A central center-back: Often the most experienced defender, responsible for organizing the defense and winning headers.
3. A right-sided center-back: Responsible for defending the right flank and supporting the right-wing back or midfielder.

The key characteristics of a three-at-the-back formation include:

* Width: The formation often relies on wing-backs or wide midfielders to provide width and support to the defense.
* Flexibility: The three defenders can shift and adjust to deal with different types of attacks, such as switching to a flat back four or a back five in certain situations.
* Protection: The extra defender provides additional protection for the goalkeeper and can help to neutralize opposition attacks.
* Counter-attacking: The formation can allow for quick transitions from defense to offense, as the wing-backs and midfielders can make runs into space and catch the opposition off guard.

The three-at-the-back formation typically operates in the following ways:

* The wing-backs or wide midfielders push high up the pitch to support the attack and provide width.
* The central midfielder(s) sit deeper to provide defensive cover and distribute the ball to the attackers.
* The three defenders work together to defend against opposition attacks, often using a ""zonal marking"" system to protect specific areas of the pitch.
* The goalkeeper often plays a sweeper-keeper role, coming out of the box to distribute the ball and start counter-attacks.

Overall, the three-at-the-back formation can be an effective way to defend against opposition attacks while also providing a solid platform for counter-attacking and creating scoring opportunities.",2026-05-20T07:59:09.538302+00:00
Q016,CONCEPT,hard,groq-llama,"The Regista is a unique and highly specialized role within soccer, originating in Italian football. The term 'regista' translates to 'regulator' or 'director' in English, which accurately describes the player's primary function.

A Regista is a central midfielder who plays a deeper, more controlling role, focused on dictating the tempo of the game, protecting the defense, and distributing the ball to teammates in more attacking positions. Key characteristics of a Regista include:

1. **Visionary passer**: Registas possess exceptional passing range, accuracy, and timing, often playing short and long balls to both teammates and forwards.
2. **Defensive shield**: They provide a safe passage from defense to midfield, intercepting opposition passes and winning the ball back to start counter-attacks.
3. **Positioning and reading the game**: Registas have a deep understanding of the game, anticipating opponents' movements and exploiting weaknesses in their formations.
4. **Set-piece expertise**: Registas are often involved in organizing set pieces, such as free kicks and corners, and can be responsible for delivering the final ball.

Compared to a standard central midfielder, a Regista differs in several ways:

1. **Deeper role**: Registas typically start further back, providing a safe anchor for their team and offering more time to read the game.
2. **Greater emphasis on passing and controlling**: Registas focus on maintaining possession and distributing the ball to teammates, whereas standard central midfielders often prioritize pressing, intercepting, and winning the ball back.
3. **Less involvement in direct attacking play**: Registas usually don't participate as actively in direct attacking runs or goal-scoring opportunities; instead, they focus on supporting their more advanced teammates.

Examples of successful Registas in recent years include:

- Jorginho (Chelsea and Italy)
- Rodrigo Battaglia (Sporting CP and Uruguay)
- Miralem Pjanic (Juventus and France)

The Regista role is highly specialized and often requires a deep understanding of the game, excellent passing range, and exceptional vision. Teams that successfully incorporate a Regista into their midfield can enjoy significant benefits in terms of controlling possession, dictating the pace of the game, and creating scoring opportunities.",2026-05-20T07:59:11.563521+00:00
Q016,CONCEPT,hard,groq-llama70b,"The regista is a specific type of deep-lying playmaker in football, typically operating in a central midfield position. The term ""regista"" is Italian, meaning ""director"" or ""conductor,"" which accurately reflects the player's role in controlling the tempo of the game.

A regista is a highly skilled and intelligent player who sits deep in midfield, often near the defense, and is responsible for dictating the flow of the game. Their primary function is to receive the ball from the defense, read the game, and then distribute it to other players, usually the more advanced midfielders or forwards, to create scoring opportunities.

The key characteristics of a regista include:

1. Exceptional vision and passing range: They have the ability to pick out long-range passes and switch the point of attack with precision.
2. High level of technical skill: Registas are usually comfortable on the ball, with excellent ball control and the ability to beat opponents with their dribbling.
3. Tactical awareness: They have a deep understanding of the game, allowing them to read the opposition's shape and identify areas to exploit.
4. Ability to control the tempo: Registas can slow down or speed up the game, depending on the situation, by adjusting their passing pace and movement.

Compared to a standard central midfielder, a regista is more focused on playmaking and controlling the game, rather than solely on winning the ball back or providing defensive cover. While a standard central midfielder might be more concerned with breaking up opposition attacks, a regista is more focused on creating attacks for their own team.

The main differences between a regista and a standard central midfielder are:

* Positioning: Registas often sit deeper, while standard central midfielders might play in a more advanced role or have more freedom to roam.
* Playing style: Registas are more focused on passing and controlling the tempo, while standard central midfielders might be more involved in tackling, intercepting, and pressing the opposition.
* Creative responsibility: Registas are often the primary creators in their team, while standard central midfielders might have more of a supporting role.

Examples of renowned registas include Andrea Pirlo, Xabi Alonso, and Sergio Busquets, who have all excelled in this role and demonstrated the unique qualities required to be a successful regista.",2026-05-20T07:59:14.761743+00:00
Q017,CONCEPT,hard,groq-llama,"In a three-at-the-back system, the libero is a specialized defender who plays in front of the two central defenders and behind the defensive midfielder. The term ""libero"" is Italian for ""free,"" which accurately describes the libero's liberty to roam anywhere in the defense, except the goalkeeper's domain.

The main roles and responsibilities of a libero include:

1. Sweeper: The libero acts as a sweeper, sweeping up opposition attacks with their speed and agility to clear the ball from danger. They can also intercept opposition passes to prevent opposition attacks.
2. Organiser: Liberos are often responsible for distributing the ball to other team members, organizing the defense, and helping with transitional play.
3. Free role: Unlike traditional center-backs, the libero often has more freedom to roam and can play anywhere in the defensive third of the field except the goalkeeper's domain.
4. Defensive insurance: Liberos provide an additional defensive layer, often as the last line of defense, by supporting the two central defenders and the goalkeeper.

The libero differs from a traditional center-back in several ways:

1. Positioning: While traditional center-backs tend to stay closer to the goal or in defensive positions, the libero often plays deeper and provides an extra layer of protection.
2. Style of play: Center-backs often focus on defensive solidity and winning headers, whereas the libero is more focused on their agility, vision, and ability to play out from the back.
3. Role in possession: Center-backs are often more involved in defensive duties, whereas the libero often acts as the ""link"" player, distributing the ball to other team members and helping to transition from defense to attack.
4. Flexibility: Liberos often have more freedom to roam and are capable of playing in different positions or adapting to different situations, whereas traditional center-backs tend to stay in their designated positions.

In summary, the libero is a specialized defender in a three-at-the-back system who focuses on organizing the defense, sweeping up opposition attacks, and providing an additional layer of protection, often with a more flexible and roaming role compared to traditional center-backs.",2026-05-20T07:59:16.816057+00:00
Q017,CONCEPT,hard,groq-llama70b,"In a three-at-the-back system, the role of a libero (also known as a sweeper or free defender) is to play behind the other two centre-backs, often in a more advanced position, and have the freedom to read the game and make interceptions. The main differences between a libero and a traditional centre-back are:

1. **Positioning**: A libero plays deeper and more centrally than traditional centre-backs, often between the defence and midfield. This allows them to have a broader view of the game and anticipate opposition attacks.
2. **Responsibilities**: A libero's primary role is to anticipate and intercept opposition passes, rather than simply marking an opponent. They are expected to be highly skilled in reading the game, anticipating opponents' movements, and making decisive interventions.
3. **Freedom to roam**: Liberos are often given the freedom to roam and move into areas where they can intercept passes or win the ball back. This requires a high level of spatial awareness, vision, and decision-making.
4. **Distribution**: Liberos are often expected to be comfortable on the ball and distribute it effectively to the rest of the team, starting counter-attacks or maintaining possession.
5. **Defensive expertise**: While traditional centre-backs focus on defending their specific area or marking an opponent, a libero is expected to be an expert in defensive strategies, such as anticipating runs, blocking shots, and winning headers.

In contrast, traditional centre-backs in a three-at-the-back system tend to:

1. **Mark opponents**: They are often tasked with marking specific opponents, preventing them from receiving the ball, and limiting their movement.
2. **Defend a specific area**: They are responsible for defending a specific area of the pitch, such as the left or right side of the penalty area.
3. **Focus on aerial battles**: Traditional centre-backs often focus on winning headers and aerial battles, particularly from set pieces.

The use of a libero in a three-at-the-back system provides several benefits, including:

* Increased defensive flexibility and adaptability
* Improved ability to anticipate and intercept opposition attacks
* Enhanced distribution and possession retention
* Ability to launch quick counter-attacks

However, the role of a libero also requires a high level of technical, tactical, and physical ability, as well as excellent decision-making and communication skills.",2026-05-20T07:59:20.292221+00:00
Q018,CONCEPT,hard,groq-llama,"In football tactics, the half-space refers to the area between the center back and the full-back (either left or right). This region is also sometimes referred to as the ""inside space"" or ""overlapping zone."" It's an area where a midfielder with the ability to cut inside, or a full-back that overlaps, can often find a large amount of space and create attacking opportunities.

The half-space is a targeted area by attacking teams for several reasons:

1. **Overlapping opportunities**: Full-backs often try to make runs down the flank, looking to overlap with the attacking midfielder or winger. This creates space in the half-space, where an attacking midfielder or winger can cut inside and collect the ball, often leading to a through-ball or opportunity to shoot.

2. **Center back overload**: When the full-back overlaps, it can create a numerical imbalance at the back. If the center back stays put, it leaves space in the center of the defensive line, or they can be called into action, giving the attacking team's winger or attacking midfielder an advantage.

3. **Free movement**: In some formations, especially 4-3-3 or 4-2-3-1, the attacking midfielder or wide midfielder can find themselves in the half-space with minimal defensive pressure. This allows them to find space and have more freedom to operate, making runs, creating opportunities and often beating defenders.

4. **One-on-one situation**: With a good attacking midfielder or midfielder with the ability to cut inside, teams can often find themselves with a one-on-one situation in the half-space. This can be a nightmare for defenders as the attacking player often has the pace, skill and decision-making to find an opening and create a scoring opportunity.",2026-05-20T07:59:22.160197+00:00
Q018,CONCEPT,hard,groq-llama70b,"In football tactics, the half-space refers to the area on the pitch that is situated between the center and the wing, roughly 15-20 yards from the touchline. It is called the half-space because it is neither fully central nor fully wide, hence the term ""half-space."" This area is often considered a crucial zone in modern football, as it offers a unique combination of characteristics that make it an attractive target for attacking teams.

The half-space is targeted by attacking teams for several reasons:

1. **Space to operate**: The half-space often provides more space for attackers to receive and turn with the ball, compared to the more congested central areas or the tightly marked wings. This allows them to create opportunities to beat their markers and progress the attack.
2. **Accessibility to both center and wing**: The half-space is close enough to the center of the pitch to allow for easy exchanges with central midfielders or strikers, while also being near enough to the wing to provide width and stretching the opponent's defense.
3. **Vulnerability of opponent's defensive structure**: The half-space can exploit the defensive structure of the opponent, as it often falls between the responsibility of the full-back and the center-back. This can lead to confusion and uncertainty among the defenders, creating opportunities for the attacking team to exploit.
4. **Opportunities for combinations and interplay**: The half-space is an ideal area for combinations and interplay between attackers, as it allows for quick exchanges and rotations that can unsettle the opponent's defense.
5. **Creation of overloads and 2-vs-1 situations**: By targeting the half-space, attacking teams can create overloads and 2-vs-1 situations, where two attackers can combine to beat a single defender, leading to opportunities for crosses, shots, or passes into the box.

To target the half-space effectively, attacking teams often employ specific tactics, such as:

* Using wide midfielders or wingers who can drift into the half-space and create opportunities for interplay.
* Employing attacking midfielders who can operate in the half-space and create combinations with other attackers.
* Utilizing strikers who can drop deep into the half-space and create space for other attackers to make runs into the box.
* Implementing a high-pressing game to win the ball back quickly and transition into the half-space, catching the opponent's defense off guard.

Overall, the half-space is a critical area in modern football, and attacking teams that can effectively target and exploit it can gain a significant advantage over their opponents.",2026-05-20T07:59:25.541008+00:00
Q019,CONCEPT,hard,groq-llama,"In football, a pressing trigger is a signal or instruction that activates a team's pressing defense, which is a high-intensity pressuring tactic aimed at winning the ball back quickly by applying pressure on the opponent as soon as they receive a pass.

Coaches use pressing triggers to organize defensive pressure in several ways:

1. **Spatial triggers**: These are specific areas or zones on the pitch where the opponent is likely to receive a pass. Coaches identify these areas based on their opponent's playing style, tactics, and previous performances. When the opponent enters these areas, the defensive team is triggered to press.
2. **Player triggers**: These are specific opponents or players who are likely to receive passes in certain situations. Coaches identify these players based on their skills, playing style, and positioning on the pitch. When these players receive passes, the defensive team is triggered to press.
3. **Timing triggers**: These are specific moments or situations when the opponent is likely to receive a pass. Coaches identify these timing triggers based on their opponent's tactics, such as when they are about to receive a pass on the counter-attack or in a one-on-one situation with a defender.
4. **Event triggers**: These are specific situations or events that trigger a high-intensity press, such as when the opponent is in a counter-attack or when they win a corner kick.

Coaches use different types of triggering mechanisms to create a more dynamic and adaptive defensive strategy. For example:

* **Trigger zones**: Coaches divide the pitch into specific zones where the opponent is likely to receive passes, and defensive players are triggered to press when they enter these zones.
* **Man-marking triggers**: Coaches assign specific defenders to mark specific opponents, who become trigger points for the press when they receive passes.
* **Zone-based triggers**: Coaches divide the defensive team into specific zones, and players in each zone are triggered to press when the opponent enters that area.

Coaches also use various communication methods to trigger the press, such as:

* **Verbal cues**: Coaches give specific verbal instructions to their players, such as ""Press!"" or ""Win the ball back!""
* **Visual cues**: Coaches use hand or arm signals to indicate when the press should be triggered.
* **Audible signals**: Coaches use specific sounds or whistles to trigger the press.

By using pressing triggers, coaches can create a more organized and effective defensive strategy that adapts to their opponent's playing style and tactics.",2026-05-20T07:59:27.618605+00:00
