question_id,category,difficulty,model,response,timestamp
Q001,CONCEPT,easy,groq-llama,"The offside rule in football is a crucial part of the game, and it can be a bit complex. Here's a breakdown:

**Basic Principle:**
A player is considered offside if they are closer to the opponent's goal line than both the ball and the second-to-last opponent when the ball is played forward.

**Key Conditions:**

1. **Position:** The offside line extends from the goal post to the sideline (perpendicular to the goal line). Any part of a player's body, including their head, arms, and legs, must cross the offside line before the ball is played forward, for them to be considered offside.
2. **Interfering:** If a player is in an offside position, they must also be actively interfering with play or gaining an advantage from it. If they're simply in an offside position and not interfering, they won't be penalized.
3. **Play is Forward:** The ball must be played forward, either by a teammate or an opponent. This means that the ball is moving in the direction of the opponent's goal.

**Exceptions:**

1. **Own Half:** A player cannot be offside in their own half of the field.
2. **Throw-ins:** Players cannot be offside during throw-ins.
3. **Corner Kicks:** Players cannot be offside during corner kicks.
4. **Goalkeeper:** The goalkeeper is not considered a defender, so they can be anywhere on the field without being offside.

**Key Clarifications:**

1. **Neutrality:** A player is not considered offside if they're in line with the second-to-last opponent and are neither ahead nor behind them.
2. **Support:** A player who has stayed even or moved backward after committing an offside error will be allowed to rejoin play once they're in line with the second-to-last opponent.
3. **Active Play:** A player who is receiving a forward pass while still onside is considered active in play and can be offside if they receive the ball.

**Summary:**
To be called offside, a player must:

* Be in an offside position (closer to the goal line than the last opponent).
* Be actively interfering with play.
* Receive the ball while in an offside position.

Keep in mind that the offside rule can be subjective, and referees have a significant amount of discretion when it comes to making calls. However, the above guidelines should give you a good understanding of the rule.",2026-05-20T07:56:30.747121+00:00
Q001,CONCEPT,easy,groq-llama70b,"The offside rule in football is a regulation that prevents attacking players from gaining an unfair advantage by staying ahead of the ball and the opposing team's defense. According to the rule, a player is considered offside if they are closer to the opponent's goal line than both the ball and the second-to-last opponent when the ball is played forward.

To break it down further, here are the key points to consider:

1. **The player must be in the opponent's half of the field**: If a player is in their own half, they cannot be offside.
2. **The player must be closer to the goal line than both the ball and the second-to-last opponent**: This is the key factor in determining offside. The second-to-last opponent is usually a defender, but it can be any opponent who is not the goalkeeper.
3. **The ball must be played forward**: If the ball is played backwards or laterally, the offside rule does not apply.
4. **The player must be interfering with play or gaining an advantage**: If a player is even with the second-to-last opponent, or behind them, they are not considered offside. However, if they are ahead of them and become involved in the play, either by receiving the ball or blocking an opponent, they can be called offside.

There are some exceptions and nuances to the offside rule, such as:

* **If a player is even with the second-to-last opponent**: In this case, they are not considered offside.
* **If a player receives the ball directly from a goal kick, corner kick, or throw-in**: They cannot be offside.
* **If a player is behind the ball when it is played forward**: They cannot be offside, even if they run past the second-to-last opponent after the ball is played.

Overall, the offside rule is designed to prevent attacking players from camping out near the opponent's goal and waiting for long balls to be played forward. It's a complex rule, but it's an important part of the game that helps maintain fairness and balance.",2026-05-20T07:58:04.622342+00:00
Q002,CONCEPT,medium,groq-llama,"A pressing strategy, also known as high-pressing or intense pressing, is a defensive approach used in football where a team immediately applies pressure on the opponent after losing possession of the ball, with the goal of winning the ball back quickly, disrupting their opponent's attacking flow, and gaining territorial advantage.

A pressing team typically employs several key tactics to achieve this:

1. **Quick recovery**: The defending team recovers quickly to the opponent's side of the pitch, often immediately after losing possession, in order to cut off avenues for the opponent's attack.
2. **Compact shape**: The defensive unit forms a compact, solid shape, with players closely pressed together, making it difficult for the opponent to find space to play the ball.
3. **Active movement**: Players actively move to challenge the opponent, not just staying in their designated positions. This involves intelligent, coordinated movement to create confusion and pressure on the opponent.
4. **Targeted pressure**: The pressing team applies pressure on the opponent's ball-carrying player or key areas of the pitch, such as the wings or central areas, to limit their options and restrict their creative freedom.
5. **Pressing lines**: The team typically uses two or more lines of pressure, with the first line applying direct pressure on the opponent, and a second line providing additional pressure, making it easier to win the ball back.

Benefits of pressing strategy include:

- **Recovery of possession**: Pressing allows the team to win the ball back quickly, regaining control and creating counter-attacking opportunities.
- **Reducing opponent space**: Pressing limits the opponent's ability to use space effectively, restricting their attacking options and making it harder for them to create scoring chances.
- **Gaining territorial advantage**: Pressing can lead to a higher number of ball recoveries in the opponent's half, increasing the team's possession time and chances to create scoring opportunities.

However, pressing can be physically demanding, requiring high levels of fitness, coordination, and tactical awareness. If overused or not executed effectively, pressing can lead to burnout, mistakes, and counter-attacking opportunities for the opponent.",2026-05-20T07:58:06.767708+00:00
Q002,CONCEPT,medium,groq-llama70b,"A pressing strategy, also known as ""pressing"" or ""high-intensity defending,"" is a defensive tactic used in football (soccer) where a team applies high pressure on the opponent immediately after losing possession of the ball. The objective is to win the ball back quickly, rather than retreating and defending deeper in their own half.

Here's how it works:

1. **Trigger**: When a team loses possession, they trigger the press by sending one or more players to harass the opponent and win the ball back. This can be a midfielder, a forward, or even a defender, depending on the team's formation and strategy.
2. **Pressure application**: The pressing player(s) apply pressure on the opponent, trying to limit their space, time, and options to make a pass or dribble. This can include tackling, intercepting passes, or simply being in a position to win the ball back.
3. **Supporting players**: The rest of the team provides supporting pressure, often in the form of a cohesive unit, to cut off passing options and prevent the opponent from escaping the press. This can involve midfielders and defenders positioning themselves to block potential passing lanes.
4. **Winning the ball back**: If the press is successful, the team wins the ball back in a high area of the pitch, allowing them to launch a quick counter-attack or maintain possession in the opponent's half.
5. **Transition**: If the press is unsuccessful, the team must quickly transition into a more defensive shape to protect against a potential counter-attack.

Types of pressing strategies:

* **High press**: Applying pressure in the opponent's half, close to their goal.
* **Mid-block press**: Pressing in the middle third of the pitch, around the center circle.
* **Low press**: Applying pressure in the team's own half, further away from the opponent's goal.

Benefits of a pressing strategy:

* **Quick ball recovery**: Winning the ball back quickly can lead to scoring opportunities.
* **Disrupting opponent's rhythm**: Pressing can disrupt the opponent's ability to maintain possession and build attacks.
* **Energy conservation**: By winning the ball back quickly, a team can conserve energy and reduce the need for prolonged defensive efforts.

However, a pressing strategy also carries risks, such as:

* **Leaving space behind**: If the press is unsuccessful, the team may be vulnerable to counter-attacks.
* **Overexertion**: Pressing can be physically demanding, and if not managed properly, can lead to player fatigue.

Overall, a well-executed pressing strategy can be an effective way to gain a defensive advantage and create scoring opportunities, but it requires careful planning, coordination, and player fitness.",2026-05-20T07:58:10.046677+00:00
Q003,CONCEPT,hard,groq-llama,"The main difference between a False 9 and a traditional striker lies in their role and responsibilities on the pitch.

A traditional striker, often referred to as a target man, is a player who primarily focuses on scoring goals. They are usually physically strong, have good finishing ability, and often hold up the ball to bring others into play. Traditionally, strikers would make runs into the box, create space for themselves, and capitalize on scoring opportunities.

On the other hand, a False 9, also known as a 'Second Striker' or 'Attacking Midfielder Playing as a Striker', is a player who occupies the same position as a striker (number 9) but adopts a different style of play. They often don't focus solely on scoring goals but are involved in a more dynamic and tactical style of play. False 9s are often agile, have great vision, and possess exceptional ball control, allowing them to drop deep, receive passes, create space, and set up scoring opportunities for their teammates.

The key characteristics of a False 9 are their:

1. Dropping deep: They often drop into the midfield or behind the defense to create space and receive passes.
2. Creating opportunities: They set up teammates with through balls, lay-offs, or clever positioning.
3. Not a traditional goal-scorer: While they may still score goals, their main focus is on creating chances for others rather than relying solely on scoring themselves.
4. Agility and movement: They use their speed, agility, and movement to deceive opponents and create space.

Some notable examples of False 9s include Lionel Messi, Luis Suarez, and Robert Lewandowski, who have all played in this role with great success, often creating opportunities for their teammates and scoring crucial goals as a result of their play.",2026-05-20T07:58:12.195166+00:00
Q003,CONCEPT,hard,groq-llama70b,"In football, a traditional striker, also known as a target man or a center-forward, is a player who plays as the main attacking threat, often positioned near the opponent's goal. Their primary role is to score goals, hold up the ball, and bring others into play. They usually have a physical presence, are good in the air, and have a strong finishing ability.

On the other hand, a false 9 (also known as a ""false center-forward"" or ""deep-lying striker"") is a player who starts in the center-forward position but drops deep into midfield, often creating space and confusion for the opposing team's defense. This player's primary role is not necessarily to score goals, but to act as a link between the midfield and the attack, creating opportunities for their teammates to make runs into the box.

The key differences between a traditional striker and a false 9 are:

1. **Positioning**: A traditional striker tends to stay high up the pitch, near the opponent's goal, while a false 9 drops deep, often into the midfield area.
2. **Role**: A traditional striker is primarily focused on scoring goals, while a false 9 is more focused on creating space, linking play, and bringing others into the attack.
3. **Movement**: A traditional striker tends to make more vertical runs, trying to get behind the defense, while a false 9 makes more lateral and diagonal runs, trying to create space and confusion.
4. **Involvement in the build-up**: A false 9 is often more involved in the build-up play, receiving the ball in deeper areas and distributing it to their teammates, while a traditional striker tends to be more of a finishing player, receiving crosses and through balls in the box.

Examples of players who have successfully played as false 9s include Lionel Messi, Francesco Totti, and Roberto Firmino, while traditional strikers like Robert Lewandowski, Harry Kane, and Zlatan Ibrahimović are known for their goal-scoring ability and physical presence.",2026-05-20T07:58:15.179744+00:00
Q004,CONCEPT,medium,groq-llama,"A high defensive line is a specific tactical approach in football where a team's defensive line is positioned high up the pitch, often near the opponent's half. This style of play is often referred to as ""parking the bus"" or ""defending in numbers"" when defending, but when pushing high, it's ""high line."" Its aim is to:

1. Gain more possession and time to create counter-attacks.
2. Overload the opponent's defense and prevent them from establishing any kind of possession.
3. Protect the defensive unit by preventing the opponent from creating long passes behind it.

The Risks associated with High Defensive Line include:

1. **Counter-attacking threats**: A team that presses high can be caught on the back foot if their counter-pressing is not timed perfectly. If a forward team quickly wins the ball, they can quickly create a counter-attack.

2. **Overcommitting and losing possession**: High defensive lines put extra pressure on defenders to maintain the high line, which may cause them to overcommit to a tackle, resulting in losing the ball.

3. **Creating spaces**: In trying to press high, a team can leave spaces in behind their defense if their midfield is not supporting. Quick-witted opponents can exploit these spaces.

4. **Injury and fatigue risk**: High-intensity pressing tactics can lead to fatigue, especially for the full-backs and central midfielders, putting them at risk of injury.

5. **Defensive errors**: Pressing high can sometimes lead to over-confidence and reckless decisions by defenders, which may lead to avoidable defensive errors.

However, when executed correctly, a high defensive line can also be very effective in forcing opponents to play long, high-risk passes.",2026-05-20T07:58:17.212844+00:00
Q004,CONCEPT,medium,groq-llama70b,"A high defensive line is a tactical approach in football where the defensive line, typically consisting of the center-backs and sometimes the full-backs, plays closer to the halfway line than usual. This means they are positioned higher up the pitch, often around 30-40 yards from their own goal, rather than the traditional deeper position near the penalty area.

The benefits of a high defensive line include:

1. **Pressing high up the pitch**: By playing closer to the opponent's midfield, the defense can apply pressure on the opponent's players, winning the ball back quickly and reducing the opponent's time to create scoring opportunities.
2. **Reducing space for opposition attacks**: A high defensive line can compress the space between the defense and the opponent's attack, making it more difficult for the opponent to create scoring chances.
3. **Allowing for a higher midfield press**: With the defense playing higher, the midfielders can also push up and press the opponent, creating a more intense and aggressive press.

However, a high defensive line also carries significant risks:

1. **Exposure to pacey counter-attacks**: If the opponent can bypass the press and quickly transition the ball to their fastest players, a high defensive line can leave the defense vulnerable to pacey counter-attacks, with the opponent's players having a clear run at goal.
2. **Increased risk of being caught out by long balls**: A high defensive line can leave the defense vulnerable to long balls over the top, which can catch the defense off guard and create one-on-one situations with the goalkeeper.
3. **Difficulty in dealing with aerial threats**: A high defensive line can also make it more challenging for the defense to deal with aerial threats, such as crosses and set pieces, as the defense may be too far up the pitch to effectively defend against these types of attacks.

To mitigate these risks, teams that employ a high defensive line often need to have:

1. **Quick and agile defenders**: Defenders who can recover quickly and catch up to opponents who have beaten the press.
2. **Excellent communication and organization**: The defense needs to be well-organized and communicate effectively to ensure that they can cover each other's positions and protect against counter-attacks.
3. **A strong and athletic goalkeeper**: A goalkeeper who can cover a lot of ground and make saves on one-on-one situations can help to reduce the risks associated with a high defensive line.

Overall, a high defensive line can be an effective tactic when executed correctly, but it requires a high level of technical ability, tactical awareness, and physical fitness from the defensive players.",2026-05-20T07:58:20.079317+00:00
Q005,CONCEPT,easy,groq-llama,"When a team ""plays out from the back,"" it refers to their strategy of starting with the goalkeeper distributing the ball to a defender, typically a center-back, rather than kicking the ball long downfield. This approach often involves a series of short passes between defenders and midfielders to build a possession advantage, and then look for opportunities to find space and attack.

Playing out from the back involves the following key attributes:

1. **Possession-based football**: The team prioritizes maintaining possession of the ball, recognizing the value of short passes in creating attacking opportunities.
2. **Build-up play**: Defenders and midfielders work together to build attacks, maintaining a high level of possession and creating space to release the ball forward.
3. **Positioning and movement**: Players are positioned strategically to receive passes and create opportunities for counter-attacks or transitions.
4. **Quick, precise passing**: The team relies on accurate passing to move the ball quickly up the pitch, rather than relying on long balls.

This approach is often associated with the philosophies of coaches like Pep Guardiola, who emphasizes control and possession, and has been adopted by several top-tier teams in recent years, including Manchester City, Liverpool, and Barcelona.

Overall, playing out from the back is a strategic approach to winning the ball back quickly and maintaining possession, which can lead to more scoring opportunities and a higher tempo of play.",2026-05-20T07:58:21.821340+00:00
Q005,CONCEPT,easy,groq-llama70b,"When a team plays out from the back, it means that they start their attacking movements from their own defensive third of the field, often involving their goalkeeper and defenders in the initial stages of possession. This approach involves the goalkeeper distributing the ball to the defenders, who then look to play short passes to each other, or to the midfielders, in order to maintain possession and slowly build up an attack.

Playing out from the back requires a high level of technical ability, decision-making, and coordination among the defending players. The team aims to:

1. Maintain possession: By playing short passes, the team looks to keep the ball and prevent the opposition from gaining possession.
2. Create space: As the defenders and goalkeeper play out from the back, they aim to create space and draw the opposition's players out of position, which can lead to opportunities for counter-attacks.
3. Attract pressure: The team may deliberately attract pressure from the opposition, allowing them to identify and exploit any weaknesses in the opponent's defensive structure.

However, playing out from the back also carries some risks, such as:

1. Conceding possession: If the team fails to play out from the back effectively, they may concede possession in a dangerous area of the field, leading to counter-attacks.
2. Vulnerability to presses: If the opposition applies high pressure, the team playing out from the back may struggle to maintain possession and could be forced into long balls or mistakes.

Overall, playing out from the back is a tactical approach that requires a well-organized and technically gifted team, as well as a deep understanding of the game and the opposition's strategy.",2026-05-20T07:58:24.382754+00:00
Q006,CONCEPT,easy,groq-llama,"A counter-attack is a tactical strategy in football where a team swiftly transitions from a defensive posture to a more aggressive attacking stance, often exploiting the opponent's weakened defensive position after losing possession of the ball.

Typically, a counter-attack involves the following steps:

1. **Recovery**: The opposing team loses possession of the ball, often through a tackle, interception, or turnover. This allows the defending team to gain temporary control.
2. **Transition**: The defending team rapidly moves the ball up the field using swift passing and player movement, trying to catch the opponent off guard before they can settle into their defensive shape.
3. **Overload**: The counter-attacking team often attempts to create numerical superiority on the ball by using the width of the field, using wingers or full-backs to provide width and stretch the defense.
4. **Pivot point**: The ball is played through to a central player, often the midfield or attacking trio, who acts as a pivot and distributes the ball to their teammates.
5. **Final phase**: The counter-attacking team targets the opponent's goal with speedy and decisive attacks, often using the speed and agility of their attacking players to break through the defense.

Some common characteristics of a successful counter-attack include:

- Speed: Quick transitions and rapid player movement allow the counter-attacking team to catch the opponent off guard.
- Numerical superiority: Creating numerical superiority on the ball can help to outmaneuver the opponent's defense.
- Space exploitation: Using the width of the field and exploiting the opponent's defensive shape can create opportunities for counter-attacks.
- Decision-making: The central pivot player's ability to make quick decisions and distribute the ball effectively is crucial in executing a successful counter-attack.

When executed well, counter-attacks can be an effective way to create scoring opportunities and catch the opponent off guard, as seen in various football matches throughout history.",2026-05-20T07:58:26.536168+00:00
Q006,CONCEPT,easy,groq-llama70b,"A counter-attack is a tactical strategy in football where a team quickly transitions from defending to attacking, often immediately after gaining possession of the ball, in an attempt to catch their opponents off guard and exploit the space left behind their defense. The primary objective of a counter-attack is to create a scoring opportunity before the opposing team can reorganize and regain their defensive shape.

A counter-attack is typically executed in the following way:

1. **Winning the ball back**: The defending team wins possession of the ball, often through a tackle, interception, or a goal kick/punt.
2. **Quick transition**: The team quickly plays a long pass or a series of short passes to a player who has space to run into, often a speedy winger or a target man.
3. **Identifying space**: The player in possession identifies the space behind the opposing team's defense and looks to exploit it, either by dribbling into the space or playing a through-ball to a teammate.
4. **Supporting runs**: Other players from the counter-attacking team make supporting runs into the box or into channels, creating options for the player in possession and stretching the opposing team's defense.
5. **Finishing the attack**: The counter-attacking team aims to create a scoring opportunity, either through a shot on goal, a cross into the box, or a pass to a teammate in a scoring position.

To execute a successful counter-attack, teams often employ the following key elements:

* **Pace**: Quick players who can rapidly cover ground and catch opponents off guard.
* **Vision**: Players who can identify space and pick out passes to teammates making supporting runs.
* **Timing**: The ability to release the ball at the right moment, allowing teammates to make runs into space.
* ** Organization**: A well-organized defense that can win the ball back quickly and efficiently transition into a counter-attack.

Some notable teams that have excelled at counter-attacking in recent years include Liverpool under Jürgen Klopp, Atlético Madrid under Diego Simeone, and Leicester City under Claudio Ranieri. These teams have used counter-attacking to great effect, often catching their opponents off guard and scoring crucial goals on the break.",2026-05-20T07:58:29.813156+00:00
