question_id,category,difficulty,model,response,timestamp
Q043,COMPARE,medium,groq-llama70b,"The 4-3-3 and 4-2-3-1 formations are two of the most commonly used formations in football. While they share some similarities, there are distinct tactical differences between them.

**4-3-3 Formation:**

In a 4-3-3 formation, the team lines up with four defenders, three midfielders, and three forwards. The midfielders are usually arranged in a triangle, with one player playing as a deep-lying midfielder (often referred to as a ""regista"" or ""anchor"") and the other two playing as box-to-box midfielders.

The key characteristics of a 4-3-3 formation are:

* A strong emphasis on wide play, with the wingers (usually the two forwards on either side) hugging the touchline and providing width to the team.
* A high-pressing game, with the forwards and midfielders pressing the opponent's defense to win the ball back quickly.
* A focus on quick transitions from defense to attack, using the pace and agility of the wingers to catch the opponent off guard.
* The deep-lying midfielder acts as a pivot, controlling the tempo of the game and distributing the ball to the other midfielders and forwards.

**4-2-3-1 Formation:**

In a 4-2-3-1 formation, the team lines up with four defenders, two defensive midfielders, three attacking midfielders, and one striker.

The key characteristics of a 4-2-3-1 formation are:

* A stronger emphasis on central midfield control, with the two defensive midfielders providing a shield in front of the defense and allowing the fullbacks to push forward.
* A more flexible and dynamic attacking midfield trio, with the players often interchanging positions and creating confusion among the opponent's defense.
* A lone striker, who acts as a target man and holds up the ball, bringing others into play and creating opportunities for the attacking midfielders to make runs behind the defense.
* The two defensive midfielders provide a solid foundation, allowing the team to absorb pressure and quickly transition to counter-attacks.

**Key differences:**

* Midfield structure: The 4-3-3 has a more fluid midfield triangle, while the 4-2-3-1 has a clearer distinction between the defensive and attacking midfielders.
* Wide play: The 4-3-3 emphasizes wide play, while the 4-2-3-1 focuses more on central midfield control and attacking midfield creativity.
* Striker role: The 4-3-3 often features a more mobile and interchanging front three, while the 4-2-3-1 has a lone striker who acts as a focal point for the attack.

Overall, the 4-3-3 is often used by teams that want to dominate possession and press high up the pitch, while the 4-2-3-1 is used by teams that want to control the central midfield area and quickly transition to counter-attacks.",2026-05-20T08:00:59.107623+00:00
Q044,COMPARE,medium,groq-llama,"Total Football as implemented by the Netherlands in the 1970s and tiki-taka by Barcelona in the 2010s share some similarities, but also have distinct differences. Here's a comparison of the two styles:

**Similarities:**

1. **Team-based football**: Both Total Football and tiki-taka emphasize a team-based approach, where individual players sacrifice personal glory for the greater good of the team.
2. **Possession football**: Both styles focus on maintaining possession of the ball, which allows teams to dictate the pace and terms of the game.
3. **Quick interplay**: Both Total Football and tiki-taka rely on quick, precise passing to move the ball through different parts of the field.

**Differences:**

1. **Formation**: Total Football was characterized by a fluid 4-3-3 formation, where players were expected to switch positions freely. Barcelona's tiki-taka, on the other hand, often employed a more rigid 4-3-3 or 4-2-3-1 formation, with Messi typically playing as the focal point.
2. **Individual creativity**: Total Football relied on the collective efforts of a squad, whereas tiki-taka often centered around individual talents, such as Johan Cruyff's creative genius in the 1970s and Lionel Messi's exceptional skill in the 2010s.
3. **Speed and movement**: Total Football teams were known for their pace and athleticism, which allowed them to transition quickly from defense to attack. Tiki-taka, while also possessing great technical ability, often emphasized controlling possession and wearing down opponents through sustained pressure.
4. **Defensive approach**: Total Football teams were more aggressive in their defensive approach, often pressuring opponents high up the field. Tiki-taka teams, on the other hand, frequently focused on maintaining a higher defensive line and protecting their goal through a collective, positional approach.
5. **Game tempo**: Total Football games often featured a more frantic pace, with teams creating chaos through their fluid movement and pressing. Tiki-taka, while also energetic, typically involved a more methodical tempo, with teams maintaining possession and probing for openings.

**Legacy and Impact**: Both Total Football and tiki-taka have had a profound influence on the game. The Netherland's 1974 World Cup campaign and Barcelona's 2009 Champions League triumph, facilitated by tiki-taka, have inspired a new wave of teams to adopt more possession-based and attacking styles.

While there are similarities between Total Football and tiki-taka, the two styles cater to distinct playing philosophies and team profiles. Total Football's emphasis on collective fluidity and pressing suits teams with a strong technical base and athletic ability, whereas tiki-taka's focus on possession and individual creativity is often more suited to teams with exceptional technical talents and tactical discipline.",2026-05-20T08:01:01.564776+00:00
Q044,COMPARE,medium,groq-llama70b,"Total Football, as played by the Netherlands in the 1970s, and tiki-taka, as employed by Barcelona in the 2010s, share similarities but also have distinct differences. Both styles emphasize possession-based football, flexibility, and creativity, but they differ in their execution and overall approach.

Similarities:

1. **Possession-based approach**: Both Total Football and tiki-taka focus on maintaining possession of the ball to control the game and wear down opponents.
2. **Flexibility and interchanging positions**: Players in both systems are encouraged to be flexible and exchange positions, creating confusion for opponents and allowing for more creative freedom.
3. **Emphasis on technique and ball control**: Both styles require players with excellent technical skills, such as dribbling, passing, and ball control, to execute the high-intensity, possession-based game.

Differences:

1. **Formation and structure**: Total Football, pioneered by the Netherlands, often used a 4-3-3 or 4-2-4 formation with a more fluid, dynamic approach. Players would frequently interchange positions, making it difficult for opponents to mark them. In contrast, Barcelona's tiki-taka typically employed a 4-3-3 or 4-1-4-1 formation, with a stronger emphasis on maintaining a solid defensive shape.
2. **Pace and tempo**: Total Football was often characterized by a more direct, vertical approach, with players like Johan Cruyff and Rob Rensenbrink making rapid, incisive runs behind the defense. Tiki-taka, on the other hand, focused on a slower, more patient build-up, with an emphasis on short, intricate passing sequences to break down opponents.
3. **Pressing and defensive approach**: The Netherlands' Total Football teams were known for their aggressive, high-pressing approach, which aimed to win the ball back quickly after losing possession. Barcelona's tiki-taka, while still pressing opponents, focused more on maintaining a solid defensive shape and using the midfield trio to dictate the tempo of the game.
4. **Player roles and responsibilities**: In Total Football, players were often expected to be highly versatile and adapt to different positions during the game. In contrast, Barcelona's tiki-taka relied on specialized players, such as Xavi Hernandez and Andres Iniesta, who excelled in specific roles and were responsible for controlling the tempo of the game.
5. **Coaching influence**: Rinus Michels, the Dutch coach, is often credited with developing the Total Football philosophy, which emphasized individual creativity and flexibility. Pep Guardiola, who managed Barcelona during their tiki-taka era, refined the style by incorporating a more disciplined, structured approach, with a strong emphasis on teamwork and collective responsibility.

In summary, while both Total Football and tiki-taka share similarities in their possession-based approach and emphasis on flexibility, they differ in their formation, pace, defensive approach, player roles, and coaching influence. Total Football was often more direct and dynamic, with a focus on individual creativity, whereas tiki-taka was characterized by a slower, more patient build-up, with a stronger emphasis on teamwork and collective responsibility.",2026-05-20T08:01:05.381384+00:00
Q045,COMPARE,medium,groq-llama,"There are several key differences between the English Premier League (EPL) and Spain's La Liga, both structurally and stylistically.

**Structural Differences:**

1. **League Format:** La Liga has a slightly different format than the EPL. La Liga uses the ""home and away"" system for each team in a 38-match season, where each team plays every other team twice (once at home and once away). In contrast, the EPL currently has 10 rounds of 38 matches with 3 or 4 matches every 2 weeks.

2. **Teams Promoted/Relegated:** La Liga has a system of promotion and relegation, where teams are awarded points according to position in the league and play a relegation play-out if necessary, similar to the English Football League (EFL) system. In La Liga, two teams are promoted from the Segunda División and two teams are relegated from La Liga.

3. **Salary Cap:** There is no official salary cap in the EPL, but there is an agreement between the Premier League and the players' union to set a cap on player wages (around 50% of total revenues for the club), whereas La Liga has no official salary cap.

**Stylistic Differences:**

1. **Possession-Based Football vs. Counter-Attacking Football:** Spanish teams are known for their possession-based style of play, using intricate passing and movement to control the game. In contrast, EPL teams often employ counter-attacking tactics to exploit their opposition's high defensive line, using pace and direct passing to catch opponents off guard.

2. **Pressing:** La Liga teams, particularly Real Madrid and Barcelona, excel at pressing, aggressively pursuing the ball and winning it back quickly. This tactic has been less prevalent in the EPL, although some teams, like Liverpool, have incorporated pressing into their play.

3. **Defensive Style:** EPL teams often prioritize defensive solidity, setting up with a strong defensive unit and a ""park-the-bus"" approach. La Liga teams have traditionally focused on attacking flair, with a more fluid and dynamic defensive approach.

4. **Tactical Flexibility:** Both Leagues have teams with diverse playing styles and tactics, but there's a general impression that La Liga teams often have more technical expertise and flexibility to adjust their tactics mid-match.

5. **Player Profiles:** La Liga teams typically attract more skillful technical players, like midfielders and wingers, who thrive in possession-based systems. EPL teams, on the other hand, often sign more physical and athletic players who excel in counter-attacking and physical football.

These differences contribute to distinct on-field identities and fan experiences for both leagues, reflecting the unique historical, cultural, and technical contexts that shape them.",2026-05-20T08:01:07.606523+00:00
Q045,COMPARE,medium,groq-llama70b,"The English Premier League (EPL) and Spain's La Liga are two of the most prominent and competitive football leagues in the world. While both leagues feature top-class teams and players, there are significant structural and stylistic differences between them.

**Structural Differences:**

1. **Competition Format**: Both leagues follow a standard double-round robin format, where each team plays every other team twice (home and away). However, the EPL has 20 teams, while La Liga has 20 teams as well, but with a more complex relegation and promotion system.
2. **Relegation and Promotion**: The EPL has a straightforward relegation system, where the bottom three teams are relegated to the English Football League Championship (the second tier). In La Liga, the bottom three teams are relegated to the Segunda División, but the top two teams from the Segunda División are promoted, and the third and fourth teams enter a playoff tournament to determine the third promoted team.
3. **Scheduling**: The EPL typically starts in August and ends in May, with a winter break in January. La Liga, on the other hand, starts in August and ends in May, but with a shorter winter break in January.

**Stylistic Differences:**

1. **Playing Style**: La Liga is often associated with a more technical, possession-based style of play, emphasizing short passes, ball control, and individual skill. The EPL, while also valuing possession, tends to be more physical, direct, and fast-paced, with a greater emphasis on long balls, counter-attacks, and set pieces.
2. **Tactical Approach**: La Liga teams often employ a 4-3-3 or 4-2-3-1 formation, with a focus on midfield control and creative freedom for attacking players. EPL teams, by contrast, may use a variety of formations, including 4-2-3-1, 4-3-3, and 3-4-3, with a greater emphasis on defensive solidity and quick transitions.
3. **Player Development**: La Liga has a strong tradition of developing technically gifted players through its youth academies, such as La Masia (Barcelona) and La Fábrica (Real Madrid). The EPL, while also investing in youth development, tends to have a more mixed approach, with some teams prioritizing academy development and others relying on external recruitment.
4. **Fan Culture**: The fan culture in La Liga is often more passionate and intense, with a strong emphasis on regional identity and rivalry. The EPL, while also having dedicated fans, tends to have a more global and commercialized following, with a greater emphasis on broadcasting and sponsorship.

**Other Key Differences:**

1. **Financial Resources**: The EPL has significantly higher revenue from broadcasting rights, sponsorship, and matchday income, which allows its teams to attract and retain top talent. La Liga, while still a major league, has faced financial challenges in recent years, leading to a greater emphasis on developing young players and selling them to wealthier clubs.
2. **International Competitions**: Both leagues have a strong presence in European competitions, but the EPL has historically performed better in the UEFA Champions League and Europa League, while La Liga has dominated the UEFA Super Cup and FIFA Club World Cup.

In summary, while both the EPL and La Liga are elite football leagues, they have distinct structural and stylistic differences, reflecting their unique histories, cultures, and approaches to the sport.",2026-05-20T08:01:10.869171+00:00
Q046,COMPARE,medium,groq-llama,"The traditional number 10 and the false 9 are two unique positional roles that serve as crucial focal points in a team's attacking strategy. While they both contribute to the team's attacking prowess, their primary duties and influences on the game differ significantly.

A traditional number 10, often referred to as an attacking midfielder or deep-lying playmaker, typically plays a free-roaming, creative role. They are usually the team's key playmaker, responsible for controlling the tempo of the game, distributing the ball, and creating scoring opportunities through their vision, passing range, and dribbling skills. They usually operate in a more central area of the pitch, often between the two center backs and the opposition's defense.

In contrast, a false 9 is an attacking forward who drops deep and acts as a 'false' center-forward. Instead of occupying the striker's traditional area, they often assume a deeper, more withdrawn position, often near or in line with the center midfielder. This allows them to link play with the midfielders, create overloads in central areas, and provide an additional passing option. A false 9's primary function is not to score goals but to create space and opportunities for other attacking players. They use their movements and positioning to disrupt the defense, drawing markers away from other attacking players, or create opportunities through their own passing range or vision.

Key differences between the two roles include:

1. **Movement and positioning**: The number 10 is usually free to roam and control the tempo, whereas the false 9 is more focused on their positioning and movement, often dropping deep to create space and opportunities for others.
2. **Passing range and vision**: A traditional number 10 typically has a more extensive passing range and is responsible for creating scoring opportunities through their vision and passing skills. A false 9 may also offer some passing range, but it is often not the primary focus of their position.
3. **Attacking responsibilities**: While both roles contribute to the team's attacking play, a traditional number 10 is usually more directly involved in scoring goals, particularly through their own shooting and finishing. A false 9, as mentioned, tends to be more focused on creating space and opportunities for other attacking players.
4. **Interconnectedness with other players**: The false 9 frequently interacts with multiple attacking players, often forming triangles, diagonal moves, or combinations that confuse the opposing defense. A traditional number 10, while still influential, may focus more on their own ability to control the game or individual skills.

In summary, while both positions are key components of an attacking unit, the traditional number 10 is focused on creative playmaking and scoring goals, whereas the false 9 is a space-creating, link-man role that disrupts the opposition's defense and opens opportunities for other attacking players.",2026-05-20T08:01:13.853785+00:00
Q046,COMPARE,medium,groq-llama70b,"A false 9 and a traditional number 10 (attacking midfielder) are two distinct roles with different tactical functions, although they can share some similarities.

A traditional number 10 is an attacking midfielder who plays behind the main striker(s) and is responsible for:

1. Creating scoring opportunities through their vision, passing range, and ball control.
2. Controlling the tempo of the game and distributing the ball to their teammates.
3. Often dropping deep to collect the ball, turning, and then playing forward passes to the strikers or wingers.
4. Providing a link between the midfield and the attack, facilitating the transition from defense to offense.

In contrast, a false 9 is a striker who:

1. Drops deep into midfield, often into the space traditionally occupied by the number 10, to create confusion among the opposition's defenders.
2. Acts as a ""regista"" or deep-lying playmaker, collecting the ball and distributing it to their teammates, rather than holding up the ball as a traditional target man.
3. Creates space for their teammates to make runs into by dragging the opposition's defenders out of position.
4. Often facilitates the creation of scoring opportunities through their movement and vision, rather than scoring goals themselves.

The key differences between the two roles are:

* Positioning: A traditional number 10 tends to play in a more advanced position, closer to the striker(s), while a false 9 drops deep into midfield.
* Role in the build-up: A false 9 is more involved in the initial build-up, collecting the ball and distributing it, whereas a traditional number 10 tends to receive the ball in more advanced areas and create scoring opportunities from there.
* Movement: A false 9's movement is more focused on creating space and confusion, whereas a traditional number 10's movement is often more focused on finding pockets of space to receive the ball and create scoring opportunities.

However, both roles require excellent vision, ball control, and passing range, and can be highly effective in creating scoring opportunities for their team. The choice between using a traditional number 10 or a false 9 often depends on the team's overall tactical approach, the players' skills and strengths, and the opposition's defensive setup.",2026-05-20T08:01:16.721595+00:00
Q047,COMPARE,medium,groq-llama,"In football, defensive midfielders (CDMs) and box-to-box midfielders are two distinct positions within the midfield trio. While they share some similarities, their primary roles differ in key aspects.

**Defensive Midfielder (CDM):**

1. **Primary focus on defense**: CDMs prioritize protecting the backline and preventing opponents from creating scoring opportunities.
2. **Tackling and interceptions**: They excel at winning the ball back through tackles and interceptions, often breaking up opposition attacks.
3. **Clearing danger**: CDMs help to clear the ball from danger, usually by redistributing possession to their teammates or playing it long to keep pressure off their defense.
4. **Limited involvement in forward play**: Their focus is on defense, so they tend to engage less in forward attacking play.

**Box-to-Box Midfielder:**

1. **Balance between defense and attack**: Box-to-box midfielders contribute to both defense and attack, often tracking back to support their defense while also creating scoring opportunities for their team.
2. **High energy levels**: These midfielders are known for their endurance and ability to cover a lot of ground throughout the match.
3. **Tackling and interceptions**: Like CDMs, they're skilled at winning the ball back through tackling and interceptions.
4. **Creative involvement**: Box-to-box midfielders often create opportunities for their team through their vision, passing range, and ability to control the game's tempo.

Key differences:

- **Focus**: CDMs prioritize defense, while box-to-box midfielders balance defense and attack.
- **Creative involvement**: Box-to-box midfielders tend to be more involved in forward play and create scoring opportunities, whereas CDMs focus on breaking up opposition attacks.
- **Energy levels**: Box-to-box midfielders require higher energy levels to cover more ground and engage in both defensive and attacking play.

These differences are not absolute and can vary depending on the team's tactical approach, the midfielders' individual skills, and the match situation.",2026-05-20T08:01:18.667728+00:00
Q047,COMPARE,medium,groq-llama70b,"The key differences between a defensive midfielder (CDM) and a box-to-box midfielder are:

1. **Primary Responsibility**: A CDM's primary responsibility is to defend and protect the back four, breaking up opposition attacks and distributing the ball to other midfielders or defenders. In contrast, a box-to-box midfielder's primary responsibility is to support both the defense and the attack, covering a lot of ground and contributing to all phases of the game.

2. **Positioning**: CDMs typically sit deeper, often in front of the defense, to intercept passes and win the ball back. Box-to-box midfielders, on the other hand, are more fluid in their positioning, moving up and down the pitch to support both the defense and the attack.

3. **Tactical Freedom**: CDMs usually have limited tactical freedom, as their role is to provide defensive stability and protection. Box-to-box midfielders, by contrast, often have more tactical freedom to roam and make runs into the box, creating scoring opportunities.

4. **Work Rate**: Both positions require a high work rate, but box-to-box midfielders tend to cover more distance during a game, as they need to support both the defense and the attack.

5. **Skill Set**: While both positions require a good level of technical ability, CDMs often focus on defensive skills such as tackling, intercepting, and reading the game. Box-to-box midfielders, on the other hand, need to be well-rounded, possessing a combination of defensive and attacking skills, including passing, dribbling, and scoring ability.

6. **Transition Play**: CDMs often focus on winning the ball back and distributing it to other players to start counter-attacks. Box-to-box midfielders, by contrast, are often involved in transition play, using their energy and endurance to quickly move the ball from defense to attack.

In summary, while both positions are crucial to a team's success, the CDM is more focused on defensive duties, whereas the box-to-box midfielder is more involved in supporting both the defense and the attack, requiring a higher level of endurance, tactical awareness, and technical ability.",2026-05-20T08:01:21.431085+00:00
