question_id,category,difficulty,model,response,timestamp
Q057,ANALYSIS,easy,groq-llama,"Teams often adopt a more conservative approach in the away leg of knockout competitions due to several strategic reasons. Here are a few key factors:

1. **Protecting the advantage**: By maintaining a solid defensive performance in the away leg, teams can limit the chances of the opponents scoring away from home. This reduces the pressure on the away team in the return leg, giving them a better chance to defend their lead.

2. **Preserving resources**: The away leg is often the more difficult match to win, as teams need to face stiff competition on unfamiliar territory. By taking a more cautious approach, teams can preserve their energy and resources for the return leg, increasing their chances of sealing a victory in their own stadium.

3. **Creating an advantage in the return leg**: A conservative approach in the away leg can allow the team to create an advantage in the return leg by reducing the opposition's scoring chances. If the score is level, the away team may feel more confident in pushing for a win in the return leg, given that the away goal rule favors them.

4. **Psychological factors**: A more defensive stance in the away leg can also have a psychological impact. By taking the momentum away from the home team and limiting their opportunities, teams can gain an intangible advantage, which can translate to a stronger mental state in the return leg.

5. **Avoiding collapse**: Conversely, some teams opt to take a more conservative approach to avoid an embarrassing defeat in the away leg. This caution can also serve as a safety net, reducing the pressure to win and providing a more manageable target for the return leg.

Overall, a more conservative approach in the away leg can provide a strategic advantage for teams, allowing them to create a favorable environment for the return leg and ultimately increasing their chances of progressing to the next round.",2026-05-20T08:02:14.361214+00:00
Q057,ANALYSIS,easy,groq-llama70b,"Teams often adopt a more conservative approach in the away leg of knockout competitions for several strategic reasons:

1. **Away goal rule**: In most knockout competitions, the away goals rule is applied, where a team that scores more away goals than their opponent will advance in case of a tie. By being more conservative, teams aim to minimize the number of away goals conceded, making it more difficult for their opponent to gain an advantage.
2. **Defensive solidity**: A conservative approach allows teams to prioritize defensive solidity, reducing the risk of conceding early goals and giving themselves a better chance to absorb pressure. This approach can help to nullify the opponent's attacking threats and limit their scoring opportunities.
3. **Countering on the break**: By defending deeply and compactly, teams can look to catch their opponents on the counter-attack, exploiting any spaces left behind as the home team commits players forward. This approach can lead to quick transitions and scoring opportunities on the break.
4. **Managing the game**: A conservative approach can help teams manage the game, controlling the tempo and reducing the opponent's ability to dictate the pace of the match. This can lead to a more even contest, where the away team can look to capitalize on any mistakes or lapses in concentration from their opponent.
5. **Preserving energy**: Playing away from home can be physically and mentally demanding, especially in high-intensity knockout matches. By adopting a more conservative approach, teams can conserve energy and reduce the risk of fatigue, which can be crucial in the latter stages of the competition.
6. **Protecting a lead (if applicable)**: If a team has a lead from the first leg, a conservative approach can help them protect that advantage, reducing the risk of conceding goals and giving themselves a better chance to progress to the next round.

Overall, a conservative approach in the away leg of knockout competitions allows teams to be more strategic, managing the game and minimizing risks while still looking to capitalize on any opportunities that arise.",2026-05-20T08:02:17.546813+00:00
Q058,ANALYSIS,easy,groq-llama,"Physical fitness and conditioning have always been crucial components of a professional footballer's development. However, their importance has grown significantly in modern football due to several factors.

Firstly, modern football has become more demanding and physically intense than ever before. The speed and pace of the game are unmatched, and players need to be capable of maintaining high standards over 90 minutes. The increased possession-based style of play, pressing, and high-intensity counter-pressing require players to be extremely fit and agile.

Secondly, teams are now employing data analysis to optimize individual players' roles and movements on the pitch. This 'data-driven' approach often relies on precise physical attributes such as speed, agility, endurance, and power, making physical fitness and conditioning increasingly important for maximizing a player's effectiveness.

Thirdly, the increased number of games and competitions, such as cup matches, has led to a prolonged season, which can be demanding for players. Maintaining peak physical fitness and conditioning becomes essential in managing fatigue, reducing the risk of injury, and maintaining performance standards throughout the season.

Lastly, advances in sports science and technology have allowed coaches, sports scientists, and players to better understand the importance of physical preparation and conditioning in football. Improved methods of testing and monitoring player fatigue, combined with the use of GPS tracking, muscle biopsies, and other diagnostic tools, provide valuable insights into players' physical condition, enabling them to optimize their training protocols and develop more effective training programs.

In summary, the importance of physical fitness and conditioning in modern professional football has grown significantly due to the increased physical demands of the game, the need for precise physical attributes to optimize individual performance, the prolonged season, and advancements in sports science and technology.",2026-05-20T08:02:19.900318+00:00
Q058,ANALYSIS,easy,groq-llama70b,"Physical fitness and conditioning have become increasingly important in modern professional football due to several key factors:

1. **Increased pace of the game**: The modern game is faster and more intense than ever before, with players covering more distance and sprinting at higher speeds. To keep up with this pace, players need to have a high level of cardiovascular fitness, muscular endurance, and speed.
2. **Tactical complexity**: Contemporary football tactics often involve high-pressing, counter-pressing, and quick transitions, which demand a high level of physical fitness to execute effectively. Players need to be able to recover quickly from intense bursts of activity and maintain their performance over the course of 90 minutes.
3. **Injury prevention and management**: With the increased physical demands of the game, players are more susceptible to injuries. A well-structured conditioning program can help reduce the risk of injury by improving strength, flexibility, and mobility. Additionally, conditioning can aid in the rehabilitation and recovery process, enabling players to return to the field more quickly.
4. **Data analysis and sports science**: The use of data analysis, GPS tracking, and sports science has become more prevalent in modern football. This allows coaches and trainers to monitor player performance, track fatigue levels, and tailor conditioning programs to individual needs. As a result, teams can optimize player fitness and gain a competitive edge.
5. **Compressed schedules and fixture congestion**: Modern professional football often involves crowded schedules, with multiple games played in a short period. This requires players to be able to recover quickly and perform at a high level with limited rest. A well-structured conditioning program can help mitigate the effects of fixture congestion and enable players to maintain their performance over an extended period.
6. **Evolution of player roles and positions**: The modern game has seen a shift towards more dynamic and flexible player roles, with many players expected to perform multiple functions during a match. For example, a full-back may be required to support both defensive and attacking phases, which demands a high level of physical fitness and conditioning.
7. **Increased emphasis on athleticism**: The modern game places a greater emphasis on athleticism, with players required to possess a combination of speed, strength, power, and agility. A well-designed conditioning program can help develop these physical attributes, enabling players to excel in their respective positions.

In summary, the increased importance of physical fitness and conditioning in modern professional football is driven by the need to cope with the high-intensity nature of the game, prevent injuries, and optimize performance. By prioritizing conditioning, teams can gain a competitive advantage, improve player durability, and ultimately achieve greater success on the field.",2026-05-20T08:02:23.347710+00:00
Q059,ANALYSIS,easy,groq-llama,"When a team is protecting a narrow lead in the final minutes of the match, they often switch to a more defensive formation for several strategic reasons:

1. **Conservation of energy**: By dropping deeper and adopting a defensive shape, players can conserve their energy and avoid risking a counter-attack. This helps to prevent overexertion and ensures they can maintain their focus for the remaining minutes.

2. **Prevention of counter-attacks**: A defensive formation can help to prevent the opposing team from launching effective counter-attacks. By packing the midfield and defense, the team reduces the space and opportunities for the opposing team to break free and score.

3. **Protection of the goal**: By committing more players to defense, the team can tighten up their defensive shape and protect their goal more effectively. This involves players forming a higher defensive line, with players positioned close to the goal to minimize the risk of the opposing team scoring a quick goal.

4. **Reducing the risk of a conceding a goal**: Teams often use a 'parking the bus' tactic, where they concentrate on defending and protecting their lead, rather than risking an attack and potentially conceding a goal. This approach can help to prevent an upset and secure the three points.

5. **Maintaining a lead**: Finally, a defensive formation can help teams maintain their lead by absorbing pressure and minimizing the opposition's opportunities to create clear-cut chances. By being solid at the back, teams can ensure they don't concede an equalizing goal and lose their lead.

By adopting a more defensive formation in the final minutes of the match, teams can minimize risks, conserve energy, and ultimately secure a win.",2026-05-20T08:02:25.906821+00:00
Q059,ANALYSIS,easy,groq-llama70b,"Teams often switch to a more defensive formation when protecting a narrow lead in the final minutes of a match for several strategic reasons:

1. **Reducing space and opportunities for the opposition**: By adding more defenders or midfielders with defensive responsibilities, the team can congest the area in front of their goal, making it more difficult for the opposing team to create scoring opportunities.
2. **Protecting against counter-attacks**: A more defensive formation allows the team to defend against quick breaks and counter-attacks, which are common when a team is pushing forward in search of an equalizer.
3. **Conserving energy**: By dropping deeper and absorbing pressure, the team can conserve energy and reduce the risk of their players being caught out of position, which can lead to scoring chances for the opposition.
4. **Limiting opposition's attacking options**: A defensive formation can limit the opposition's attacking options, forcing them to rely on long-range shots or crosses, which are often less effective than attacking play through the center of the pitch.
5. **Increasing the likelihood of winning the ball back**: With more players behind the ball, the team can win the ball back more quickly if the opposition gains possession, reducing the time and space available for them to launch a meaningful attack.
6. **Managing the clock**: By switching to a more defensive formation, the team can also manage the clock more effectively, running down the remaining time and reducing the opposition's chances of scoring an equalizer.

Common defensive formations used in these situations include:

* Switching from a 4-3-3 to a 4-5-1 or 5-4-1
* Dropping a midfielder or forward into a deeper role to provide extra defensive cover
* Introducing a defensive midfielder or a center-back to add more solidity to the team's defense

Overall, switching to a more defensive formation can be an effective way to protect a narrow lead, but it requires careful management and coordination to avoid conceding a goal and to ensure that the team can still pose a threat on the counter-attack if necessary.",2026-05-20T08:02:28.914405+00:00
Q060,ANALYSIS,easy,groq-llama,"Accurate set-piece delivery is considered a crucial skill for teams with physically dominant strikers because it allows the strikers to use their physical presence to their advantage. 

Physically dominant strikers often have a significant aerial threat due to their height, strength, and jumping ability. They can cause problems in the box with their headers, which can be particularly effective in situations where the goalkeeper is forced to come out, or when players are vying for the ball in a crowded area.

Set-piece situations such as corners, free kicks, and penalties provide opportunities for these strikers to showcase their aerial threat. However, for this to be maximized, accurate delivery from the set-piece is essential. A mis-hit or weak delivery can lead to the strikers being unable to attack the ball effectively, and the opponent has a better chance of clearing it safely.

An accurate set-piece delivery allows the physically dominant striker to position themselves well in the area, time their jump, and make contact with the ball in a location that is most advantageous for their aerial threat. It enables them to be more clinical in their finishing, and potentially create scoring opportunities that might be more difficult for the opponent to deal with.

This combination of physicality in the box and precise set-piece delivery can be particularly effective when deployed against teams with limited aerial threat, or when pitted against a goalkeeper who may be vulnerable to crosses or set-pieces. As such, being able to execute accurate set-piece delivery effectively is seen as a key skill for teams with physically dominant strikers.",2026-05-20T08:02:30.754943+00:00
Q060,ANALYSIS,easy,groq-llama70b,"Accurate set-piece delivery is considered a crucial skill for teams with physically dominant strikers for several reasons:

1. **Aerial Threat**: Physically dominant strikers often possess a significant aerial threat, using their height, strength, and jumping ability to outmuscle opponents and win headers. Accurate set-piece delivery allows these strikers to capitalize on their aerial prowess, providing them with opportunities to score goals from crosses, corners, and free kicks.
2. **Targeted Service**: A well-delivered set piece can be directed to a specific area of the box, allowing the physically dominant striker to attack the ball in a position where they can use their strength and power to overwhelm defenders. This targeted service increases the likelihood of creating scoring opportunities.
3. **Creating Chaos**: Accurate set-piece delivery can create chaos in the box, as defenders struggle to cope with the physical presence of the dominant striker. This chaos can lead to mistakes, miscommunications, and ultimately, goal-scoring opportunities.
4. **Exploiting Defensive Weaknesses**: Teams with physically dominant strikers can use accurate set-piece delivery to exploit defensive weaknesses, such as a lack of height, strength, or organization in the box. By delivering the ball to the right area, they can put pressure on the defense and create opportunities for their striker to score.
5. **Increasing Scoring Opportunities**: Accurate set-piece delivery can significantly increase the number of scoring opportunities for a team with a physically dominant striker. By providing a consistent supply of high-quality crosses and deliveries, teams can create a high volume of chances, which can lead to a higher conversion rate and more goals.

In summary, accurate set-piece delivery is crucial for teams with physically dominant strikers as it allows them to capitalize on their aerial threat, create chaos in the box, exploit defensive weaknesses, and increase their scoring opportunities.",2026-05-20T08:02:33.402019+00:00
Q061,ANALYSIS,medium,groq-llama,"Pep Guardiola's Barcelona, between 2009 and 2011, was a highly dominant team that achieved unparalleled success in European and domestic football. Several factors contributed to their dominance:

1. **Tiki-Taka style of play**: Guardiola introduced the tiki-taka style of play, which emphasized short, precise passing, high pressuring, and a possession-based game. This approach allowed Barcelona to maintain control of the ball and dictate the pace of the game, often leaving opponents overwhelmed and lacking in possession.

2. **Player personnel and depth**: Guardiola had a talented squad at his disposal, featuring world-class players such as Lionel Messi, Xavi Hernandez, Andres Iniesta, and Samuel Eto'o. He also had quality depth across the pitch, with midfielders like Cesc Fabregas and midfield stalwarts like Busquets, and defenders such as Dani Alves, Gerard Pique, and Carles Puyol providing stability at the back.

3. **Defensive solidity**: Barcelona's defense was often underrated, but it was incredibly solid under Guardiola. The team's ability to absorb pressure, then immediately launch quick counter-attacks, made them difficult to beat.

4. **Flexibility and adaptability**: Guardiola's Barcelona was highly versatile and was able to adapt to different formations and opponents. He frequently switched formations and tactics mid-game, and his players were well-versed in various roles, allowing them to adapt to changing situations on the pitch.

5. **Intense training sessions**: Guardiola's training sessions were notoriously intense, with an emphasis on tactical precision and tactical awareness. The players developed high levels of fitness and were mentally prepared for the demands of competing at the highest level.

6. **Team cohesion and communication**: Guardiola emphasized the importance of teamwork and communication. The players developed a deep understanding of each other's strengths, weaknesses, and playing styles, allowing them to anticipate and react to opponents' moves.

7. **Psychological approach**: Guardiola's mindset and approach to the game were also a significant factor in their success. He created a positive and confident environment within the team, where players were encouraged to take risks and express themselves on the pitch.

The combination of these factors allowed Barcelona to dominate European and domestic football between 2009 and 2011, winning a treble in 2009 (La Liga, Copa del Rey, and Champions League), as well as multiple domestic trophies between 2009 and 2011. Their achievement served as a benchmark for future teams and influenced the development of football tactics and strategy.",2026-05-20T08:02:35.506033+00:00
Q061,ANALYSIS,medium,groq-llama70b,"Pep Guardiola's Barcelona was indeed a dominant force in European and domestic football between 2009 and 2011. There were several key factors that contributed to their success during this period:

1. **Tiki-Taka style of play**: Guardiola introduced a unique playing style characterized by short, intricate passing sequences, high pressing, and maintaining possession. This approach, known as Tiki-Taka, allowed Barcelona to control the tempo of the game, wear down opponents, and create scoring opportunities.
2. **Strong squad depth and balance**: Guardiola had a talented and well-balanced squad at his disposal, with a mix of experienced players and young, talented players from the club's famous La Masia academy. This depth allowed him to rotate players and adapt to different opponents and situations.
3. **Exceptional midfield trio**: The midfield trio of Xavi Hernandez, Andres Iniesta, and Sergio Busquets formed the backbone of the team. Xavi's vision and passing ability, Iniesta's creativity and goal-scoring threat, and Busquets' defensive prowess and distribution skills made them nearly unbeatable in the middle of the park.
4. **Lionel Messi's emergence**: During this period, Lionel Messi developed into one of the greatest players of all time. His speed, skill, and goal-scoring ability made him almost unplayable, and he often single-handedly decided matches for Barcelona.
5. **Strong defensive unit**: Despite their attacking prowess, Barcelona's defense was also extremely solid, with players like Carles Puyol, Gerard Pique, and Dani Alves forming a strong and experienced backline.
6. **High-intensity pressing**: Guardiola's teams were known for their high-intensity pressing, which allowed them to win the ball back quickly and create scoring opportunities through counter-attacks.
7. **Innovative tactics and flexibility**: Guardiola was willing to experiment with different formations and tactics, often catching opponents off guard. He would adjust his team's shape and approach to suit the opponent and the situation, making it difficult for teams to prepare for them.
8. **Focus on developing players from La Masia**: Guardiola placed a strong emphasis on promoting players from Barcelona's youth academy, La Masia. This approach not only saved the club money on transfers but also ensured that players were familiar with the team's style and philosophy from a young age.

These factors combined to make Pep Guardiola's Barcelona a dominant force in European and domestic football between 2009 and 2011, as they won numerous titles, including two La Liga championships, the Champions League, and the Copa del Rey.",2026-05-20T08:02:38.227686+00:00
Q062,ANALYSIS,medium,groq-llama,"The introduction of the back-pass rule in 1992 significantly changed the role and requirements for goalkeepers because it prohibited goalkeepers from receiving a ball deliberately backpedaled to them by a teammate. This rule aimed to reduce defensive fouls, improve player safety, and enhance the flow of the game.

Prior to the introduction of the back-pass rule, goalkeepers were often involved in the buildup and distribution of the ball, frequently receiving passes back from defenders. They played a more active role in this aspect, acting as an extra defender by breaking up opposition attacks.

With the introduction of the back-pass rule, goalkeepers were no longer able to receive these backpedaled passes, forcing them to reevaluate their role in the game. This led to significant changes in their responsibilities, including:

1. Reduced involvement in distributing the ball: Goalkeepers could no longer receive passes and distribute the ball with their feet as they once did.

2. Increased emphasis on shot-stopping and ball-handling: Goalkeepers needed to be proficient in handling high balls, crosses, and other shots from opponents, which further emphasized their shot-stopping abilities.

3. Greater focus on organizing the backline: Goalkeepers became more involved in communicating with their defenders, directing them, and marshaling the team's defense.

4. Adaptation to a more pressurized role: With the loss of the ability to distribute the ball, goalkeepers faced greater pressure as they needed to be prepared to respond rapidly to opposition attacks and counter-attacks.

In summary, the introduction of the back-pass rule shifted the focus of goalkeepers' roles, emphasizing their core skills, such as shot-stopping, ball-handling, and organizing the defense, while forcing them to adapt and become more versatile in their approach.",2026-05-20T08:02:40.862541+00:00
